review_text,rating,review_date,thumbs_up
tốt ứng dụng cho nhiều đòi đẹp ko chê được,5,2026-04-20 04:16:28,0
mua dép cuả sop mol quy tính .ma khi mang k vừa đổi trả hàng sop k hộ trợ.giờ qua tikok đổi trả nhanh lẹ hon,1,2026-04-20 04:05:22,0
hay,5,2026-04-20 04:05:05,1
ok giao nhanh,4,2026-04-20 04:00:59,0
"Ship Quá Mắc , Đổi Xu Đc Vài Xu App Lõ 😈",1,2026-04-20 03:54:36,3
tất cả các mã giảm giá đủ điều kiện dùng nhưng khi ấn đặt hàng thì lại hiển thị lôi m02/d02? vậy thì dùng mã kiểu gì?,1,2026-04-20 03:51:21,1
tiện lợi cho người mua.,5,2026-04-20 03:50:17,0
tuyệt vời,5,2026-04-20 03:43:21,0
"đơn hàng thì đồng kiểm, sàn lại k cho đồng kiểm, hàng thì dễ vỡ, làm ăn vậy dẹp mẹ đi. trước xóa gỡ hết chưa xóa tk, lần này thì xóa mẹ tài khoản luôn",1,2026-04-20 03:42:08,0
tốt,5,2026-04-20 03:35:33,0
tốt,5,2026-04-20 03:10:47,0
"1* vào app là tự động vào live & video rất phiền phức và bực mình, tắt đi mà âm thanh vẫn chạy dưới nền. Nhắn cho tổng đài hỗ trợ tắt nó đi mà không ai giúp, không biết hủy bỏ đi làm sao.",1,2026-04-20 03:08:35,1
👍,4,2026-04-20 02:55:27,0
Hàng quá tệ,1,2026-04-20 02:34:55,0
ok,5,2026-04-20 02:22:01,0
ship sai hàng khi làm hoàn tiền rất khó khăn. chủ yếu shoppe gây khó khăn,1,2026-04-20 02:08:38,2
đặt mã hời hời cái là shopee hủy đơn. làm ăn trò mèo,1,2026-04-20 01:57:31,1
rất ổn,5,2026-04-20 01:40:55,0
số dt của mình mà không đăng nhập đc,1,2026-04-20 01:35:50,1
"bao giờ thì cái chợ shopee online này sập sàn nhỉ, mong đợi quá .....",1,2026-04-20 00:33:45,3
"người mua và người bán ở trong tỉnh nhưng đơn vòng lên Hà Nội mất 3 lần mới đến tay (10 ngày mới nhận được hàng), dịch vụ vận chuyển quá kém, nên xem xét lại",1,2026-04-19 23:08:01,0
hay,5,2026-04-19 22:39:59,0
hàng ko giao báo hoàn trả,1,2026-04-19 21:33:27,0
ok,5,2026-04-19 20:42:25,1
sàn uy tín. yên tâm mua sắm,5,2026-04-19 19:59:34,0
Shopee thêm tính năng thanh toán khi nhận hàng và giảm kích thước dung lượng của ứng dụng và thêm ưu đãi giảm giá,5,2026-04-19 19:44:38,0
ok,5,2026-04-19 19:04:17,0
ko giao hàng,1,2026-04-19 18:22:15,0
quyền lợi khách hàng thì k có tới lúc cần hoàn hàng thì liên kết tài khoản ngân hàng k đc ví shoppe pay đăng kí rồi thì kêu tài khoản bị hạn chế k đc liên kết ủa r tiền t thì sao??????,1,2026-04-19 16:57:04,0
"Luon co gia tot so voi thi truong, nhung giO hang kha cham",5,2026-04-19 16:43:05,0
mới vô thì được giảm giá nha rất ok,5,2026-04-19 16:41:16,1
"Thật bực mình, cứ mỗi lần mở App là bắt ép vào xem shopee video, càng ngày càng lố bịch.",1,2026-04-19 16:14:37,4
cho mã ship 1 đống ngta đặt hàng thì kêu lạm dụng vi phạm f02 làm ăn md vl,1,2026-04-19 15:49:18,1
k mở đc???,1,2026-04-19 15:48:55,0
ok,5,2026-04-19 15:39:58,0
Ok hơn xưa rồi,5,2026-04-19 15:38:27,0
lấy xu live nhiều quá shopee khoá luôn không cho lấy?????,1,2026-04-19 15:32:35,1
shopee không cho tôi đặt hàng tôi rất bực mình mong shopee giải quyết chuyện này cho tôi,1,2026-04-19 15:29:55,2
"tôi không biết tài khoản của tôi bị lỗi gì mà không thể đặt hàng. toàn báo khu vực không hỗ trợ và tự huỷ, trong khi cùng 1 địa chỉ tài khoản khác của tôi vẫn đặt hàng được bình thường",1,2026-04-19 15:16:25,1
"shipper hẹn mà k giao, nói khách hàng từ chối nhận, cần làm việc lại với đơn vị vận chuyển 😤",1,2026-04-19 15:09:23,5
ok,5,2026-04-19 15:07:38,0
chơi game cũng ko yên với cái ứng dụng này nữa,1,2026-04-19 14:57:31,1
ok,5,2026-04-19 14:50:33,0
"shopee trơ tráo với khách hàng, chèn ép không cho trả hàng, chửi khách",1,2026-04-19 14:46:00,5
vừa mới cập nhật xong là ko mở lên được luôn. cứ báo là lỗi ko có mạng trong khi lấy đt khác thì mở đc app.,1,2026-04-19 14:38:57,1
chịu ko bt nói j,2,2026-04-19 14:37:07,3
tốt,5,2026-04-19 14:30:59,0
tệ,1,2026-04-19 14:22:56,0
tôi tạo nick mua đồ nhưng không mua được xong hỏi bên tư vấn nó lại nói không hỗ trợ tôi cảm giác shopee ngày càng không xem khách hàng ra gì nếu như được đánh giá không sao tôi xin phép đánh giá không sao,1,2026-04-19 14:17:50,0
tốt và Giao nhanh lẹ,5,2026-04-19 14:16:22,0
ok,4,2026-04-19 14:00:23,0
"cho mã giảm giá,cho săn xu đêm hôm xong ngta áp dc rẻ lại bảo ngta có dấu hiệu bất thường khóa f02 khốn nạn thật sự",1,2026-04-19 13:56:07,1
ok 👌,5,2026-04-19 13:54:25,1
"Bánh tráng trộn siêu ngon luôn 😋 Trộn đậm vị, chua cay mặn ngọt vừa đủ. Topping đầy đủ: khô bò, trứng cút, xoài, rau răm thơm nức. Ăn ghiền thiệt sự, mở bịch ra là hết lúc nào không hay 🤤 Sẽ ủng hộ dài dài!",5,2026-04-19 13:33:42,0
ok,4,2026-04-19 13:05:18,0
ok dùng và trả dễ dàng,5,2026-04-19 13:01:47,0
rất tốt,5,2026-04-19 13:00:47,1
"mãi kco tài xế nhận đơn, bụng thì đói, gọi hotline shop thì bảo shop tự động xác nhận đơn, còn tài xế thì ph do shopee điên vl",1,2026-04-19 12:59:51,1
ứng dụng shopee cũng tốt,5,2026-04-19 12:59:34,0
đang lướt google tự nhiên lòi ra shoppe,1,2026-04-19 12:57:34,0
tại sao ko free ship. phí vận chuyển cao thế hơn do mua. đúng là lừa đảo.,1,2026-04-19 12:55:17,0
tốt,4,2026-04-19 12:37:30,1
một hệ thống liên kết với các nhà bán hàng bán lẻ đa sản phẩm shoppe làm ăn rất tốt chính sách thỏa đáng mọi thứ đều tốt,5,2026-04-19 12:32:09,0
mua hàng 0₫ rất nhiều lần dùng vẫn tốt,5,2026-04-19 12:26:15,0
rất tốt,5,2026-04-19 12:22:22,1
"Tôi ghét quá đỗi apps này vì liên tục treo quảng cáo lên màn hình, mà đeo bám như đỉa, không thể xóa hoặc tắt.",1,2026-04-19 12:13:37,0
good,5,2026-04-19 11:59:10,0
"đơn đầu tiên miễn phí, rẻ hơn mấy app mik đã dùng",5,2026-04-19 11:42:44,0
ok. good,5,2026-04-19 11:32:51,0
"đớp mất 200k xu hoàn , lừa đảo thật",1,2026-04-19 11:23:41,2
tật vl tìm mãi ko thấy đổi tên vs xoá tk ở đâu,1,2026-04-19 11:22:07,2
san phẩm tốt,5,2026-04-19 11:16:39,0
hay quảng cáo quá nhiều.,3,2026-04-19 11:16:16,0
"yêu cầu bỏ ngay cái tủ giao hàng đi nhé. Có phải chỗ nào cũng có tủ đâu mà bắt khách hàng đến tủ lấy vậy, 1 cái tủ gần nhất cách 10km thì còn cần shipper giao hàng, cần app mua hàng onl làm gì nữa",1,2026-04-19 11:15:33,4
không cho dùng mã người mới,1,2026-04-19 11:13:19,0
"voucher càng ngày càng ít toàn mấy mặt hàng ko đủ điều kiện để áp mặc dù số tiền của mặt hàng đấy ko nhỏ, thêm nx ngta mua nhiều thì nên giảm giá của 1 cái đi chứ lại còn nâng lên ví dụ 1 mặt hàng với giá 46k nhưng khi mua 2 mặt hàng thì lại nhảy lên 50k, lí do ở đây là gì??",2,2026-04-19 11:08:03,0
"dạo này đặt người ta tự động hủy hoài, hủy mấy chục đơn rồi, bên ngoài không có bán mà vậy",1,2026-04-19 11:05:44,0
đều là các đồ chơi giá rẻ và còn free ship,5,2026-04-19 10:57:13,5
rất tốt ok,5,2026-04-19 10:42:53,0
oke nha _ theo dõi hàng ngày rất thích shoppy,5,2026-04-19 10:41:43,0
tuyệt vời,5,2026-04-19 09:57:31,0
hay,5,2026-04-19 09:40:48,0
lỗi gì lỗi quài bắt ngta nhập mã xãc nhận cho đã rồi không cho đăng nhập,1,2026-04-19 09:18:43,3
Tôi muốn lấy lại số điện thoại nhưng lại không được còn bị F02,1,2026-04-19 09:09:24,1
"mã giảm giá nhiều, free ship nữa. Có lúc cho mã giảm liên tục khi mua hàng. Đặt toàn hàng rẻ mà dùng chất lượng. 5* là còn ít. 10₫ không có nhưng (trải nhiệm cá nhân)",5,2026-04-19 09:07:55,0
chưa từng giải quyết triệt để khiếu nại của tôi với bưu tá vận chuyển,1,2026-04-19 09:06:53,0
hàng không như mong muốn,3,2026-04-19 08:32:04,0
ko cho dùng mã giảm giá,1,2026-04-19 07:56:14,0
giao hàng chậm. hỗ trợ kém . nên bỏ . qua bên khác mà mua,1,2026-04-19 07:54:02,1
"tốt, giá cả hợp lý",5,2026-04-19 07:46:47,0
app qua dinh,5,2026-04-19 07:44:32,0
shiper của shopee ăn lo xong ngủ,1,2026-04-19 07:42:41,0
ok,5,2026-04-19 07:42:12,0
rất thích,5,2026-04-19 07:40:57,0
10 điểm 😁,5,2026-04-19 07:33:25,0
"Thủ tục hoàn hàng nhanh chóng, dễ dàng. Ứng dụng mua hàng dễ sử dụng!",5,2026-04-19 07:31:58,0
Lỗi quá. trong 1 tháng thì tầm 10 -15 ngày ko nhận đc xu khi xem video. để ý tầm 2-3 tháng nay rồi.,1,2026-04-19 07:29:11,15
"đúng là làm ăn lừa đảo,giá ở ngoài để có 1 bấm vô mua thấy giá 100, sản phẩm thì khó tìm, tiền ship thì gấp 5 lần tiền đồ😡😡🤬🤬",1,2026-04-19 07:20:52,111
ứng dụng dành cho người lười:)))),5,2026-04-19 07:18:38,0
được ứng dụng quá được,5,2026-04-19 07:10:34,0
quá tuyệt vời!,5,2026-04-19 07:10:05,0
OK ngon,5,2026-04-19 07:04:18,0
tôt,5,2026-04-19 07:03:23,0
"tôi muốn ứng dụng này xoá khỏi thế giới, mẹ tôi ngày nào cx bắt tui đăng 20 sản phẩm thứ 7, cn còn ngày bt có 5 hoặc 10 thôi nhưng tôi đã rất mệt khi ngày nào cx phải làm. Ko làm là tôi bị dồn vào ngày mai và tôi ko đc chơi trước khi tôi làm",1,2026-04-19 06:56:50,0
Hủy đơn chả đc cứ bảo làm kích hoạt ví shoppe gì đấy mới cho hủy😡,4,2026-04-19 06:55:37,0
tốt,5,2026-04-19 06:53:54,0
quá tốt,4,2026-04-19 06:53:46,0
giao lâu lề mề shop trong 2 ngày lên 3 tuần dịch vụ giúp đỡ có như ko chả có ích gì tệ,1,2026-04-19 06:46:42,0
app loll quảng cáo vừa thôi.,1,2026-04-19 06:34:12,1
đặt đồ 1 tiếng mà không giao hàng,1,2026-04-19 06:26:02,0
"đợt này đặt hàng , không giao đã hoàn hàng , chán luôn",1,2026-04-19 06:21:36,4
dùng rất tốt,5,2026-04-19 06:21:20,0
CSKH mới vô đã gặp con AI không hiểu vấn đề thì chớ gặp người thật cũng y chang. Cần người thật giải quyết vấn đề thì người thật cũng sử dụng AI. qua là tuyệt vời giao tiếp giữa con người với con người còn chưa được mà đòi ứng dụng AI. Riết rồi có khỏi xài luôn cho đỡ nhức đầu quá,1,2026-04-19 06:18:08,0
Bảo mật thông tin khách hàng quá kém. Vừa đặt mua cái áo khoác trên shopee hôm trước hôm sau lừa đảo campuchia gọi giả danh shipper giao áo.,1,2026-04-19 06:04:42,0
hazzz mệt quá..! phiền,1,2026-04-19 06:00:31,0
"shopee food giao hàng lâu, ko cho hủy đơn hàng, gọi tổng đài thì báo ko có xử lý đơn shopee food. muốn tìm phản ánh liên hệ tự lên fb tìm. tìm rồi nói thì ko giải quyết được gì",1,2026-04-19 05:59:05,0
Ko mua đc hàng gì hết,4,2026-04-19 05:55:55,1
"khóa acc vô lý? đưa voucher cho đã xong lúc,mua lại khóa ? đặt đơn nào rẻ rẻ là k giao",1,2026-04-19 05:47:15,0
ko ship hàng,1,2026-04-19 05:42:52,0
tiện ích tiện lợi,4,2026-04-19 05:31:52,0
"rất tốt khi cần cái gì cũng có,giá lại rất chuẩn",5,2026-04-19 05:26:25,0
Shopee giờ không bảo vệ quyền lợi cho khách hàng như xưa nữa. Tính ra Điện Máy Chợ Lớn còn làm tốt hơn.,1,2026-04-19 05:25:19,1
cũng được,4,2026-04-19 05:21:12,0
yêu,5,2026-04-19 05:18:17,0
ok,5,2026-04-19 05:16:18,0
đang yên đang lành lại liên kết với xanh làm khổ nhau ra,1,2026-04-19 05:15:34,1
"hàng giao trễ hơn dự kiến, tự nhiên hoàn trả hàng về người gửi rồi huỷ đơn hàng của người ta??? chờ hàng về mấy ngày để nhận lại được như vậy đó hả",2,2026-04-19 05:12:04,0
giao hàng nhanh,5,2026-04-19 05:09:39,0
"làm ăn không hẳn hoi , t mua mà toàn hoàn gàng t về , nói chung dùng TikTok shop",1,2026-04-19 05:03:24,0
giá hợp lý,5,2026-04-19 05:02:34,0
tốt ko thể tốt hơn,5,2026-04-19 05:02:04,0
rất tiện lợi và hữu dụng,5,2026-04-19 04:57:12,0
tốt,5,2026-04-19 04:56:52,0
ok,5,2026-04-19 04:48:44,1
"Tốt nhưng hơi mini quá, nhưng công dụng thì cũng khá ổn, nhưng nó có loại 20cm trở lên hay ko vậy",5,2026-04-19 04:47:35,0
đặt đơn shoppe food 2 tiếng ko tìm đc tài xế cx ko cho hủy đơn là sao app ơi,1,2026-04-19 04:43:58,0
cũng đc mà ít quảng cáo lại nha,4,2026-04-19 04:43:39,0
"app và shop thì ok mà shiper khu vực mình ncc số lạ gọi đến mình có việc k nghe được khi gọi lại số đó thì khóa máy hay chặn cuộc gọi , shiper sau đó tự hủy đơn k bh xài app này nữa",2,2026-04-19 04:41:00,0
tốt,5,2026-04-19 04:34:44,0
tốt,5,2026-04-19 04:29:12,0
đc,5,2026-04-19 04:27:17,0
Hàng giá trị cao mà tốc độ giao hàng quá tệ !,1,2026-04-19 04:24:57,1
"app gì càng ngày càng tệ, load mãi chả lên. app bán hàng càng ngày càng tệ hơn tiktok",3,2026-04-19 04:23:09,0
nó rất tốt dùng có nhiều vé,5,2026-04-19 04:18:19,0
tốt,5,2026-04-19 04:16:00,1
"shopee là cái ứng dụng tệ nhất quản lý phần mền ko chặt chẽ đễ người dùng gắn link quảng cáo lung tung thậm chí hack quản cáo vào đt người dùng, tẩy chay shopee",1,2026-04-19 04:13:40,0
vừa đăng kí tài khoản chính chủ mà đã bị khóa với lý do là lợi dụng giảm giá,1,2026-04-19 03:55:01,1
hệ thống bán hàng được ok,5,2026-04-19 03:54:02,0
chỉ thích xu thôi,4,2026-04-19 03:51:37,0
cho voucher ng mới xg ko cho xài lúc xài dc thì lại hủy đơn vì giao dịch ko hợp lệ thế cho voucher làm gì cho xong không cho khách dùng?????,1,2026-04-19 03:49:57,0
shoope ko vào được,1,2026-04-19 03:49:36,0
tốt,5,2026-04-19 03:48:20,0
mua hàng nch là okk tiện lợi,5,2026-04-19 03:40:20,0
"bây giờ giao hàng rất chậm . đơn ở gần hà nội mà mất 1 tuần mới về, đơn k cập nhật vị trí chính xác của đơn ,hối giao thì lí do lúc nào cx là "" do lượng đơn hàng vào đợt sale tăng cao nên hàng về muộn"" mà trong khi đặt đơn vào đợt k có sale ????Giao hàng rất lâu",1,2026-04-19 03:16:42,0
ok,4,2026-04-19 03:16:38,0
ok e ơi,5,2026-04-19 03:13:16,0
rất tốt,5,2026-04-19 03:11:48,1
"giá trên desktop không đồng bộ, chỉ khi đăt mua mới biết giá thật",4,2026-04-19 02:48:17,0
không đặt được hàng cứ bão MO2/DO2,1,2026-04-19 02:18:52,1
"Shopee có thể ghi thông tin và số điện thoại của shipper cho người mua biết không, tôi tin tưởng sử dụng app nhưng lại gặp tình trạng shipper cập nhật ""Đã giao hàng"" trong khi tôi chưa nhận được hàng. Vậy gói hàng của tôi đã ở đâu?? Trong đơn hàng còn có cả thông tin cá nhân của tôi nữa, nếu bị lợi dụng làm việc xấu thì ai chịu trách nhiệm?? Mong app khắc phục lỗi shipper tự nhận hàng của khách, trân trọng!",2,2026-04-19 02:16:13,0
ít phiếugiarm gúa,4,2026-04-19 02:10:04,0
rất tốt,5,2026-04-19 01:58:02,1
đặt hàng xong tự nhiên bị văng nick đăng nhập lại bảo là tài khoản bất thường ko đăg nhập đc sms cx ko đăg nhập đc?? là sao địa chỉ sai xác nhập tỉnh rồi mà vẫn chx đổi lại dẫm đến k thay đổi thành phố ko có thủ dầu 1,1,2026-04-19 01:56:48,2
mua sắm mọi thứ đều rẻ mà lâu lâu bị lỗi phần tự vào live & video rất khó chịu,4,2026-04-19 01:55:44,1
trả hàng hoàn tiền k đc như í,5,2026-04-19 01:50:39,0
"ê cái trò gắp thú nha. gắp mà chỉ nhận được giải thưởng của 1 món, là 100 xu th ấy. đáng lẽ đc 5000 xu. chán không",1,2026-04-19 01:46:49,0
Như lol ý mua cứ bảo là ưu đãi đã hết,5,2026-04-19 01:38:37,0
Quảng cáo ứng dụng này chứa nút X giả.,1,2026-04-19 01:38:04,0
"tốt, tiện lợi ,nhiều vocho",5,2026-04-19 01:35:31,0
tốt nhất 👍,5,2026-04-19 01:28:13,0
không tin tưởng,1,2026-04-19 01:16:42,0
hài lòng,5,2026-04-19 01:04:51,0
đặt hàng xong thì tự hủy ko báo trước gì cả,1,2026-04-19 01:03:00,1
5 sao không có nhưng,5,2026-04-19 00:59:21,0
"hàng từ kho sắp giao trong 12h tới thì quay lại kho lm trò j đấy, trong khi ko ai hủy đơn cả. Hàng đang gần nhà tự nhiên quay lại kho cách cả trăm km để làm cái j",1,2026-04-19 00:33:24,0
mua xong bị fo2 vì dùng voucher giảm quá nhiều tiền và bị ghi là đơn ảo?,1,2026-04-19 00:25:00,1
hay,5,2026-04-18 23:55:09,1
đặt hàng dễ dàng giao nhanh đúng hẹn,5,2026-04-18 23:54:06,0
tốt,5,2026-04-18 23:51:40,0
giao hàng thì lâu mà cứ lè nhà lè nhè,1,2026-04-18 23:50:48,1
túi cảm thấy quá tuyệt vời,5,2026-04-18 23:33:16,0
giao hàng tận nơi nhanh chóng đóng gói cẩn thận đánh giá 5 sao cho shop ạ ❤️ sản phẩm hài lòng,5,2026-04-18 22:51:48,0
"app làm quảng cáo quâ đáng yêu 🥰, coi mà ấn thoát cứ vào trình duyệt, 1 sao k nói nhiều, phiền",1,2026-04-18 22:38:49,0
cập nhật lại theo địa chỉ mới tại Việt Nam đi để địa chỉ cũ bố thằng tây nào nhớ lại vậy.thay đổi để đổi mới đi.cứ quay về quá khứ vậy.phải nhìn về tương lai,1,2026-04-18 20:13:23,0
các sàn thấy hiện sdt ship trừ shopee nhiều lúc muốn ll ship để lấy hàng ko dc ship thì bựa ko thèm gọi tự ý hoàn bt bn đơn,1,2026-04-18 20:04:00,0
nhiều mả giảm giá xịn minh rất thích shopee nhưng minh chơi game gặp shopee quảng cào nhiều 1 sao,1,2026-04-18 18:35:49,1
"ở đâu cũng có qc , nút tắt thì bé tí , lần nào cũng vào app luôn , ức chế !",1,2026-04-18 17:59:53,0
"nhà phát triển ứng dụng viết phần mềm trên Android hạn chế quá nhiều, lỗi nhiều và giật lag nhiều thua xa khi dùng trên ios",1,2026-04-18 17:52:29,0
ok,5,2026-04-18 17:21:22,0
Bớt quảng cáo lại là 5 sao rồi.,1,2026-04-18 17:04:25,1
dùng tốt,5,2026-04-18 16:54:35,1
tốt,5,2026-04-18 16:47:36,1
tốt nhma hay lỗi mã giảm giá,5,2026-04-18 16:32:56,0
shopee bây giờ tệ quá để mấy shop spam khách hàng không cho chặn tin nhắn của shop đó ... mua có 1 lần mà nó spam năm này qua tháng nọ ... report bao nhiêu lần vẫn vậy... nói chung nát đang chuyển dần qua tiktok lazada,1,2026-04-18 16:09:34,0
đặt đơn có áp voucher thì shopper tự í hủy đơn của khách vô lí vãi,1,2026-04-18 15:59:22,1
quảng cáo phiền lag,1,2026-04-18 15:59:19,0
ổn nhưng vẫn có 1số lỗi lúc vận chuyển,4,2026-04-18 15:41:51,0
dùng tốt nên thử để đặt hàng,4,2026-04-18 15:36:33,0
rất ok,5,2026-04-18 15:30:35,0
tốt,5,2026-04-18 15:20:52,0
"quảng cáo nhiều, phiền vãi pịa",1,2026-04-18 14:51:42,2
Tốt,5,2026-04-18 14:49:53,0
ok,5,2026-04-18 14:41:35,0
hàng thì bảo 65k mà lúc nhắn mua thì 129k là sao hả còn tiền siếp 100k ý gì vậy định cheo đầu dê bán thịt chó hả .mẹ mốt nhắm bán được thì bán không thì đừng bán cái bò gì hết shoppe như bò cheo đầu dê bán thịt chó là sao hả định qua mặt tôi à hàng gì có 2 bảng giá lúc mới thấy thì 65k mà nhắn vào mua thì 129k là sao còn nói mua thì 2 thì fee ship mà mua hai lấy tiền ship100k là sao tôi cần lời giải thích làm ăn vậy thấy được không mà hởn ra nói shoppe rất tốt.tốt cái gì tốt cái đầu mày á .,1,2026-04-18 14:24:35,0
yêu soppe nhìu lam 5 sao nha,5,2026-04-18 14:12:37,0
🤭👏,5,2026-04-18 13:45:07,0
ok,5,2026-04-18 13:45:07,0
tốt,5,2026-04-18 13:37:07,0
tuyệt,5,2026-04-18 13:30:24,0
tôi mua hang .mà không thấy ai giao .theo dõi thông tin thì bảo giao hoàn thành đơn hàng rồi. là sao.,1,2026-04-18 13:25:05,1
Rất hài lòng,5,2026-04-18 13:23:53,1
cần nhiều phiếu,5,2026-04-18 13:16:42,0
"tiện lợi, đa dạng👌😊",5,2026-04-18 13:09:48,2
đáp ứng được yêu cầu,5,2026-04-18 13:07:20,1
rất tốt tôi mua đồ mình mong muốn cũng có tôi cho năm sao,5,2026-04-18 13:07:10,0
"app đặt cũng về nhưng đặt được 1,2 đơn lại không đặt được nữa cứ thử đi thử lại nó cứ hiện thông báo là MO2/DO2 mong sẽ sớm đặt được hàng",1,2026-04-18 12:57:30,0
"Xin hãy nghĩ cho những cái điện thoại ko có NFC đi, đã ko có NFC r mà toàn bắt quét, quét thế nào được??? Với cả thay đổi sđt shopee pay lằng nhằng quá, đổi trên app ko đc, gửi mail thì chả thấy rep, muốn ng dùng chạy thẳng tới trụ sở shopee xin đổi ạ???",2,2026-04-18 12:57:29,0
Sài rất ok,5,2026-04-18 12:53:50,0
quá là tuyệt vời,5,2026-04-18 12:53:34,0
đăng nhập lỗi,1,2026-04-18 12:53:22,0
Quảng cáo nhiều VC,1,2026-04-18 12:47:11,0
"sđt của t, đăng kí chính chủ r mà k đăng nhập shopee đc, đã có ng sd sđt đó, liên hệ shopee cx k hỗ trợ",1,2026-04-18 12:46:36,0
mua hàng rất ok,5,2026-04-18 12:43:37,0
ok ổn,5,2026-04-18 12:26:09,1
đg xem trên google mà cứ nhảy sang shopee .mua hàng thì ko giao mà cứ ko giao r chụp ảnh ng nào ý ko t r bảo là nhận đc r nhiều lần chứ ko phải 1 lần ko cho trả hàng mà cứ bảo shopee đồng kiểm vào live hay video thì ko thoát đc còn bị lag nữa t sẽ ko tải thêm lần nào nữa,1,2026-04-18 12:25:20,0
"Quảng cáo quá nhiều ,rõ là tôi tải shope rồi mà chơi game vẫn quảng cáo shopee ạ ,mong shopee bớt Quảng cáo lại",1,2026-04-18 12:19:58,0
miễn phí ship mua hàng thả ga,5,2026-04-18 12:16:24,0
"tiện lợi khi mua, muốn mua gì cũng có, tôi sẽ ủng hộ nhiều.",5,2026-04-18 12:14:29,0
rất tốt,5,2026-04-18 12:10:07,0
"xoá mất 3 cái tk đang sài cày xu hổm giờ tk nào không cho mua thì không cho luôn đi, mắc cl j cho đặt xong hôm sau xoá hết tk ???",1,2026-04-18 11:59:47,1
clm ship lộn hàng hoài còn ship thì ok ko cần phải chê chỉ chê cái cách shop trong đây giao hàng ko giống với mình đặt thôi cứ lộn hàng hoài luôn á,3,2026-04-18 11:58:44,0
vì tội quảng cáo quá nhiều,1,2026-04-18 11:55:23,0
rất tốt voucher 10k đến 25k lên tục,5,2026-04-18 11:41:59,0
"ở phần home cứ hiện duy nhất 4 sản phẩm lướt xuống để kiếm thêm sản phẩm thì không được, thoát ra vô lại vẫn y nguyên. tìm kiếm sản phẩm thì chỉ hiện một vài cái lướt xuống thì hiện đang tải mãi không luớt xuống được. bị nhiều lần rồi",1,2026-04-18 11:34:31,0
shoppe có nhiều thứ giá hạt dẻ lắm,5,2026-04-18 11:31:51,0
ok,5,2026-04-18 11:20:54,0
k đặt hàng đc vì giới hạn lượt mua trong 1ng mà hôm nay mình chưa đặt gì,1,2026-04-18 11:11:43,0
rất tốt,5,2026-04-18 11:01:39,0
mong shoppee cho mã giảm giá,5,2026-04-18 10:44:33,0
tuyệt vời,5,2026-04-18 10:41:33,1
đánh giá 5 ⭐⭐⭐⭐⭐,5,2026-04-18 10:37:32,0
chờ hàng về rất lâu nên tôi đã hủy đơn rồi màu shopee làm ăn cẩn thận vào,1,2026-04-18 10:33:45,0
"🤔 Mình chủ yếu mua mấy đồ của Tokusatsu, figure nhưng giá chát quá với ko có thứ mình muốn",5,2026-04-18 10:26:44,0
OK,5,2026-04-18 10:12:16,0
như qq,1,2026-04-18 10:09:50,0
nên tải về để trải nghiệm nhé mn,5,2026-04-18 10:01:19,0
shopee rất vui và hay,5,2026-04-18 09:55:48,0
ok,5,2026-04-18 09:53:05,0
shopee Pay tự ý trừ tiền không có thông báo trước lúc gọi tới thì kêu thông cảm.,1,2026-04-18 09:49:12,0
"Shopee ngày càng xem thường khách hàng! Rất rất nhiều người đã bị khóa tài khoản vĩnh viễn, với lý do vi phạm chính sách... rất mơ hồ với lỗi ""F02""",1,2026-04-18 09:47:26,8
tốt,5,2026-04-18 09:44:41,0
1 trải nghiệm tồi tệ và rác rưởi. không cho hoàn hàng vì chính sách vớ vẩn hết sức. mong mọi người qua tiktok hoặc nền tảng khác ủng hộ,1,2026-04-18 09:30:41,1
"đừng có mà tự hủy đơn của khách hàng, bực bội hết sứcc",2,2026-04-18 09:28:02,0
ok rất tốt,5,2026-04-18 09:26:42,1
tệ quá tệ,1,2026-04-18 09:22:50,0
"shopee rất uy tín, luôn bảo vệ quyền lợi của người tiêu dùng, mong shoppe tiếp tục phát huy thế mạnh, loại bỏ những shop làm ăn gian dối để trở thành một trang thương mại điện tử top đầu Việt Nam và trên thế giới.",5,2026-04-18 09:22:45,0
gỡ cài đặt lâu vl,1,2026-04-18 09:13:24,2
"rất thú vị, từ lúc tải về tới giờ toàn đặt hàng 0đ là nhiều",5,2026-04-18 09:07:07,0
hay nhưng đơn hay bih lầm bị hủy đơn ko lí do,5,2026-04-18 09:05:19,1
15h42 ngày 18/4/2026 trừ tiền vô cớ 14.778đ,1,2026-04-18 09:03:40,3
vừa rẻ vừa ngon đáng tải,5,2026-04-18 09:03:28,0
rất thích,5,2026-04-18 08:35:09,0
