review_text,rating,review_date,thumbs_up
app để mua hàng mà ko giao hàng,1,2026-05-01 03:16:08,1
ứng dụng rác,1,2026-05-01 03:07:20,0
Mấy cái voucher 500k có mà k sài đc thì cho lm j,4,2026-05-01 02:47:51,1
ứng dụng có quảng cáo rác nhất,1,2026-05-01 02:33:04,0
hài lòng,5,2026-05-01 02:31:10,0
quá tệ,1,2026-05-01 02:13:59,1
tôi rất ưng app này 🤭🤭🤭🤭🤭,5,2026-05-01 02:06:51,0
cứ hiện cái gì ý không hiểu,1,2026-05-01 01:51:30,0
tự hủy đơn của khách,1,2026-05-01 01:42:48,0
"Hàng giao quá lâu, đặt đơn 27/4, hẹn giao 29/4, đến 29 thì bảo hẹn giao 30/4, đến 30 hẹn giao 1/5, đến 1/5 thì hẹn giao 4/5, lúc nào cũng chậm muộn, quá nhiều lần r chứ k phải 1",1,2026-05-01 01:38:45,0
ok. Hài lòng.,5,2026-05-01 01:06:45,0
tự động giảm âm lượng của điện thoại cho dù đã loại bỏ hết quyền truy cập,1,2026-05-01 00:59:10,0
quảng cáo khó chịu,1,2026-05-01 00:27:13,0
tốt giao hàng đúng hẹn,5,2026-05-01 00:24:59,0
Rất ok,5,2026-05-01 00:12:01,0
đặt nhầm địa chỉ thấy bên bán chưa giao nên hủy để đặt lại mà không cho hủy,2,2026-05-01 00:08:12,0
rẻ không có lỗi,5,2026-04-30 23:23:48,2
"giao hàng k báo, giao sai địa chỉ, tự ý hủy đơn , tự ý hoàn hàng, tự trừ 10.600xu bao lâu t tích góp",1,2026-04-30 22:43:16,2
"v , không thể nào",1,2026-04-30 21:11:25,0
"Rất nhanh , rất tốt",5,2026-04-30 18:35:38,0
tệ,1,2026-04-30 17:58:47,0
rung kha tot,5,2026-04-30 17:28:04,0
tuyệt,5,2026-04-30 17:23:04,0
"Mới xoá bình luận 1 sao thì lại bị mất hàng . Giờ không xoá nữa , ăn 1 sao vĩnh viễn đi shop",1,2026-04-30 17:21:34,3
"Không ghi hạn sử dụng xu của ngày cuối tháng gần nhất, làm người dùng mất rất nhiều xu",1,2026-04-30 17:04:05,1
"app lỗi liên tục , lỗi sever mãi rồi lỗi sđt người dùng và hạn chế tích xu nữa!!",1,2026-04-30 17:01:29,0
"đặt hàng xong bom cảm giác rất thích thú , chọc tức shipper cho 5 sao",5,2026-04-30 16:17:14,0
"{Đây là ý kiến riêng của mình} Haz,mấy đơn hàng từ 0 đồng đến 10k shipper thấy rẻ nên lười ship hay sao ý. mấy đơn hàng ít tiền của mình cứ đến ngày giao hàng là nó cứ hiện trạng thái giao hàng là đã giao nhưng mình không hề nhận được một cuộc gọi nào hay là nhận được một đơn hàng nào.",1,2026-04-30 15:47:17,2
trường tôi quảng cáo cái j đó cho app á cái đang thi cách ngày cái gộp sát nhau khạn nốn,1,2026-04-30 15:45:25,0
mua đồ trên shopee. mà không có đổi trả được. cho shop 2 sao,2,2026-04-30 15:39:59,0
không firil sip,1,2026-04-30 15:15:24,0
"giá tiền hợp lý, chất lượng cao, mỗi tháng đều có 5 voucher trở lên, nói chung là mọi người nên tải và sử dụng còn đối với tôi thì sẽ đánh giá cho ứng dụng shoppee vn 💯💯💯💯💯💯💯",5,2026-04-30 15:06:19,1
Ok,5,2026-04-30 14:57:02,1
ko thể hiểu dc quên mk bấm quên đã xác thực mã otp r là dc đổi mk đây bắt nhập lại mk cũ nếu nhớ thì đã đăng nhập vào thẳng mắc gì bấm quên chi nhờ hỗ trợ thì rất tệ cứ vòng lòng nói chung rất tệ,1,2026-04-30 14:56:19,1
tốt nhưng khi có thông báo thì nghe rất ồn và to quá,4,2026-04-30 14:54:55,2
"app mã giảm quá nhiều cái hủy đơn là sao, xàm vừa thôi",1,2026-04-30 14:51:06,0
"hay đơ ,",4,2026-04-30 14:50:20,0
rác,1,2026-04-30 14:47:14,0
ok,5,2026-04-30 14:44:29,0
app phiền vãi ra,1,2026-04-30 14:42:40,1
tuyệt vời,5,2026-04-30 14:39:40,0
khoá tài khoản khách vô cớ,1,2026-04-30 14:20:57,0
hay bị lỗi và tự ý hủy đơn hàng,1,2026-04-30 13:47:56,2
mẹ ship ở shoppe food lừa đảo ko trả tiền thừa nói thì chặn số shoppe thì chẳng cho khiếu nại như c,1,2026-04-30 13:18:26,0
tốt,5,2026-04-30 13:14:37,0
Thằng KOL chặt não đi,1,2026-04-30 13:01:05,0
ngon thí,5,2026-04-30 12:42:37,0
ngon luônnnnnnnnnnnnnnnnnnnnnk,5,2026-04-30 11:22:16,0
"Tự nhiên bị tài khoản tự đăng xuất , mặc dù không làm gì.",1,2026-04-30 11:22:14,1
Mình mua toàn hiện giá sai lsao ạ mong khắc phục,1,2026-04-30 11:18:20,2
shipper lấy luôn cả hàng của khách mà gọi điện shipper không trả,1,2026-04-30 11:00:35,2
à xl mình đánh giá nhầm vs cái đánh giá 1sao vừa nãy mình định cho shoppe food mà đánh giá nhầm qua shoppe thường giao rất nhanh nhưng mong shoppe có thể cải thiện tình trạng giao hàng chậm ở shoppe food,5,2026-04-30 09:54:17,0
Thời buổi nào rồi thằng CEO còn sử dụng 100điểm=100đồng nữa. Đúng là ngu mà tỏ ra nguy hiểm về nhà mày thử cho con mày 5000 không biết nó lấy không nữa vậy mà để nhận 100 đồng cho 100 điểm đúng là t hần k inh phân l ệt mà điều hành quá một app lớn quá n hục....,1,2026-04-30 09:36:21,9
k hỗ trợ redmagic mở cửa sổ nổi,4,2026-04-30 09:14:18,0
kém toàn thời gian,1,2026-04-30 09:13:45,0
giá hơi cao,4,2026-04-30 08:44:50,0
ko đăng nhập đc số đt 🤬,1,2026-04-30 08:29:48,1
chưa giao hàng mà để đã giao hàng,4,2026-04-30 07:34:53,0
ok,5,2026-04-30 07:34:10,0
lừa đảo vì không đúng với những gì Quảng cáo,1,2026-04-30 07:30:24,0
tốt ok uy tín,5,2026-04-30 07:21:31,0
nhà tôi toàn đồ trong này🤣,5,2026-04-30 06:58:29,2
mã 0đ bịp ae nhé lk sdt vào là mất,1,2026-04-30 06:54:08,0
ok,5,2026-04-30 06:53:08,0
như lol,1,2026-04-30 06:44:37,0
đây là shop rác chứ shoppe nào ở đây,1,2026-04-30 06:10:58,0
ok,5,2026-04-30 06:07:08,0
ok tốt xịn,5,2026-04-30 05:55:05,0
nhập địa chỉ ko đc quá tệ,1,2026-04-30 05:45:30,0
tôi vào acc mới cứ bảo 0 đồng mà mua có được đâu 😡,1,2026-04-30 05:43:16,0
Nhưng hộ hơi giả,5,2026-04-30 05:32:29,0
giờ chỉ còn Shopee,5,2026-04-30 05:29:33,0
"Thật sự thấy tệ nhất ở phần hoàn hàng/trả tiền, phải đợi cần kì lâu và thậm chí đưa hàng xong. Mấy ngày sau shop nhắn chưa nhận đc hàng, đã bị tráo hành. Thế là phải mất mấy ngày nữa. Thậm chí cả tuần!",2,2026-04-30 05:22:51,3
được mua đồ thỏa thích,5,2026-04-30 05:20:27,0
"shop tư vấn nhiệt tình, chất lượng sp đảm bảo như quảng cáo, giá thành hợp lý",5,2026-04-30 05:17:59,0
mua sắm tiện lợi,4,2026-04-30 05:06:43,0
đang chơi game mà quả cáo làm thu,1,2026-04-30 04:56:31,0
shopee có nhiều ưu đãi tốt,5,2026-04-30 04:35:01,1
"ê bị ghét cái kiểu quảng cáo nha thấy ghét á , đã lâu r còn dấu thoát giả ,dấu x thì nhỏ có chút xíu ,ý quảng cáo vừa vừa th chứ ,má thấy ghét",1,2026-04-30 04:19:59,0
"Tìm mọi cách để khách hàng không dùng được mã giảm giá , có voucher đặt 500 cái khẩu trang 55k rồi lại bảo vocher không hợp lệ xóa luôn voucher =))",1,2026-04-30 04:03:01,0
"phí ship cao, giá đắt, tốt nhất là đừng mua hàng từ cái ứng dụng này",1,2026-04-30 03:57:55,1
ok,5,2026-04-30 03:47:58,1
thay đổi số điện thoại ko được toàn không xác minh được,3,2026-04-30 03:41:10,0
không dùng được COD,1,2026-04-30 03:27:59,0
lúc nào cũng quảng cáo chs mà bực 😡😡😡😡,1,2026-04-30 03:25:30,2
quá tuyệt,5,2026-04-30 02:58:02,0
nói là đơn về đến khu vực bạn sẽ giao sau 12 giờ mà 4 ngày rồi chưa giao,1,2026-04-30 02:34:43,1
các shop không tôn trọng khách hàng! nhiều shop rất láo!,1,2026-04-30 02:32:54,3
như đầu buoi mẹ giao hàng lâu vãi,2,2026-04-30 02:26:50,0
năm tốt,1,2026-04-30 02:23:09,0
"tự nhiên đng chơi game mà quảng cáo cái tự nhiên chỉ lỡ tay ấn vào thôi mà nhảy qua shopee đc đúng ngáo, mà ấn x rồi mà còn nhảy qua đc 😐",1,2026-04-30 02:19:19,2
dùng tốt 100 điểm 💯💯💯💯💯💯,5,2026-04-30 02:16:33,0
ko mua đc toàn lỗi mã M02,1,2026-04-30 02:14:49,0
ok,5,2026-04-30 02:14:23,0
vì tôi đặt hàng 0 đ cứ bắt đăng nhập số điện thoại nhưng thôi cho 5 sao,5,2026-04-30 01:58:35,0
Phải gỡ bỏ ứng dụng vì quảng cáo quá nhiều trên các trang web tin tức. quá phiền phức bực bội khi nhắp vào icon quảng cáo để thoát nhưng lại mở app. ức chế dẫn đến không còn muốn mua hàng trên shope nữa,1,2026-04-30 00:52:58,0
ok,5,2026-04-30 00:50:58,2
"shoppe sài rất là tốt luôn mọi người ạ , có rất nhiều voucher khác nhau để giảm giá , đặc biệt là khách hàng đầu tiên được giảm đến 60.000₫ mình luôn ủng hộ shoppe 😘",5,2026-04-30 00:50:38,0
shopee đáng iu quá trời,5,2026-04-30 00:43:31,0
tốt,5,2026-04-30 00:39:15,0
chất lượng,5,2026-04-30 00:18:02,0
tot,4,2026-04-30 00:08:56,0
qua nhieu voucher ngon lam,5,2026-04-30 00:01:02,0
rẽ,5,2026-04-29 23:42:28,0
"bắt người dùng ấn vào quảng cáo,để nút thoát nhỏ, tự mở app",1,2026-04-29 23:25:50,1
ok,5,2026-04-29 23:24:06,0
mua rẻ ship nhanh,5,2026-04-29 23:14:05,1
ko đăng ký được,1,2026-04-29 23:07:37,0
app như lol,1,2026-04-29 20:00:57,0
"Rất tốt. Luôn bảo vệ người tiêu dùng, trả hàng dễ dàng",5,2026-04-29 19:43:03,0
"trả lại cái thời gian đếm ngược xu màu xanh đây ,nó ko hiện nữa rồi, huhu(〒﹏〒)",1,2026-04-29 19:15:35,0
đã khóa F02 còn khóa lun acc khác trong dt thành M04 có muốn cho mua hàng nữa không tuần nào cũng khóa app đúng hãm,1,2026-04-29 18:37:30,0
"app suốt ngày lỗi, lag liên tục. Mã giảm giá thì lúc có lúc không, vừa nãy còn hiện thì lúc sau mất",1,2026-04-29 17:45:42,14
"T là Đặng phương nam số đt cuối 0174 đặt cái giá đỡ điện thoại có áp voucher shopee VIP với hơn 30.000 xu shopee với giá ≈ 40.000 Vn₫ , shipper điện đến lần thứ ba hẹn mai giao rồi không thấy tung tích đâu đến ngày hôm sau thì thấy đơn đang hoàn về người gửi . Gọi hỗ trợ ghi tin đồ các kiểu . Sử lí dài dòng mà khách hàng thì chã được lợi gì . Không có tặng voucher hay gì khác mà chỉ bảo là đặt lại đơn ? .... đợi hàng về cho đã rồi kêu đặt lại , đã vậy lúc đặt lại thì tận 63.000Vn₫?",1,2026-04-29 17:13:33,1
"ở phần shoppe xu khi mua hàng ấy, shoppe nên để người mua tự nhập số xu muốn dùng để mua hàng (miễn sao không quá 1 nửa giá trị sản phẩm) thì tiện hơn",5,2026-04-29 17:10:45,7
không nên tải hoàn tiền không được đâu đã vậy còn cho shop lừa đảo kinh doanh nữa bạn mua đồ rồi chỉ có tức thôi,1,2026-04-29 16:58:16,0
"tôi rất thích ứng dụng này, nào giúp cho bản thân có được sự thoải mái khi lướt những trang hành độc đáo",5,2026-04-29 16:56:08,1
đớp sâu vl áo mã còn mất phí ship còn tận nơi vs tự lấy đ mua còn hơn áp như cac,1,2026-04-29 16:21:06,0
fan shopee,5,2026-04-29 16:13:47,0
tệ,1,2026-04-29 16:06:40,0
sàn uy tín,5,2026-04-29 15:44:25,0
"đã liên kết tk ngân hàng lâu rồi, giờ lại bắt xác thực lại",1,2026-04-29 15:34:43,0
xu xem live đã giảm 🥺,2,2026-04-29 15:34:27,106
Giao hàng chậm quá,2,2026-04-29 15:27:11,0
"síp bơ giao hàng không tốt lắm cần hệ thống theo dõi cách làm việc của síp bơ giao hàng này nha đặc biệt là Nguyễn Văn Linh giao hàng khu vực tổ 8kp an thành phường thái hòa, tân uyên Bình Dương",1,2026-04-29 14:58:51,3
mua tự hủy,1,2026-04-29 14:53:53,0
hủy đơn trước khí gửi hàng nhưng không hoàn voucher người mới liên hệ cskh thì lấp liếm đổ lỗi hệ thống không đưa ra cách khắc phục thoả đáng,1,2026-04-29 14:24:27,1
cái con khỉ mốc nó lâu không xài bây giờ quay lại xài nó bảo lấy lấy cái l què gì tin nhắn cũng béo thấy gửi tới. cái con cờ loay hoay tốn thời gian cả tiếng đồng hồ. nếu không muốn phiền phức... tốt nhất là chơi với tik tok. trao trả hàng thì cũng vậy lòng vòng lợi cho người bán. người mua phải phụ thuộc sao điều kiện... xác định mua một là xài được nếu không xài được thì nên tự vứt bỏ. thêm cái giao hàng đùng một phát nó đến cửa nó mới gọi anh ơi có đơn hàng. không ai bao giờ báo cho biết t ch,1,2026-04-29 14:09:36,1
ko đăng nhập được,1,2026-04-29 14:05:37,0
tốt,5,2026-04-29 14:01:49,1
nhân viên ko liên hệ giao hàng. phản hồi shop là khách không liên lạc được.,1,2026-04-29 14:01:17,0
👍,5,2026-04-29 13:08:57,0
bắc đăng kí nhưng tôi không biềt làm.rồi tự nhiên mua hàng với giá cao.,1,2026-04-29 13:07:17,1
dùng cái mã giảm 80 k cũng như ko với rất rất nhiều lỗi khi mua hàng 😭😭😭,1,2026-04-29 13:03:46,1
Âm sao,1,2026-04-29 12:45:07,0
tốt,5,2026-04-29 12:40:42,0
tiện lợi,5,2026-04-29 12:35:20,0
ngon thí mong tặng nhiều voucher,5,2026-04-29 12:07:06,0
shopee lỗi ko app mã đc ko đặt đc hàng,1,2026-04-29 12:06:32,0
bắt khách hàng đăng nhập số điện thoại thông tin các kiểu chỉ đẻ đặt đơn 0₫ làm xong về giá gốc,1,2026-04-29 11:58:04,3
rất hài lòng,5,2026-04-29 11:50:21,1
quảng cáo nhiều,1,2026-04-29 11:34:59,0
"hàng thì chưa nhận được đã hiển thị là giao hàng thành công ( 3 đơn hiện giao thành công mà vẫn chưa nhận được hàng) dịch vụ chăm sóc khách hàng vẫn chưa giải quyết được vấn đề ,chỉ toàn yêu cầu trả hàng Hoàn tiền ,đơn thì đang cần gấp",1,2026-04-29 11:27:37,3
thật tuyệt vời và tiện lợi,5,2026-04-29 11:22:21,0
"ap nhảm nhí thật, tự dưng mua hàng xong bị khoá rồi ghi vi phạm chính sách. cho mã giảm giá thì ngta dùng thôi chứ mắc gì khoá",1,2026-04-29 11:14:46,4
mẹ chơi khoá cả 2 sim toàn lý do vớ vẩn gọi thì toàn nói tào lao toàn kêu là chắc lỗi ký thuật lỗi mẹ m ak lỗi lắm vậy r nào sửa xog nói mẹ coi,1,2026-04-29 11:03:04,1
"app củ lol, đánh giá shop 1* là báo lỗi sever ko cho đánh giá, gian thương lừa đảo bao che nhau à",1,2026-04-29 10:57:34,3
tuyệt vời,5,2026-04-29 10:50:58,0
vô app cứ bị lag không xem hàng gì được hết,2,2026-04-29 10:41:31,1
"ứng dụng được nha chỉ là có vài shop đăng ảnh ít quá,quá ít để biết thêm thông tin",5,2026-04-29 10:38:53,0
đặt hàng mà muốn trả hàng mà lại không trả được,2,2026-04-29 10:36:13,2
mã miễn ship đầy mà ko cho dùng là sao ngu à,1,2026-04-29 10:25:26,2
"bị lỗi à,có voucher mà đeo cho ngt xài,vô lí vailon",1,2026-04-29 10:19:33,4
tôi ko đạt được hàng,3,2026-04-29 10:18:57,1
Bây giờ không được miễn phí ship nữa rồi chán 🤧,3,2026-04-29 10:11:17,1
"càng cập nhật càng tệ, cập nhật xong giờ đặt nhầm đơn hàng huy ko đc, phải sác thực tk ngân hàng mới hủy đc, thế những người ko có tk ngân hàng như mk thì như nào phải bom hàng à còn bị mất mã giảm giá",1,2026-04-29 09:57:59,1
quảng cáo cc,1,2026-04-29 09:55:26,0
ok,5,2026-04-29 09:36:27,0
ok,5,2026-04-29 09:28:26,1
"Đã làm theo hướng dẫn của shopee rồi nhưng vẫn không nhận được xu từ shopee,thật tệ khi trải nghiệm này",1,2026-04-29 09:26:51,1
cài đặt thử nghe nói có 0₫,5,2026-04-29 08:55:37,0
lúc đầu có mã giảm giá rất ngon về sau kh còn nhưng cx có rất nhiều món có lời cho ng mua,4,2026-04-29 08:47:33,0
quá rẻ,5,2026-04-29 08:46:51,0
bị mã m02 hoài,1,2026-04-29 08:28:04,1
app ok .,4,2026-04-29 08:28:04,0
"trả 4 5 đơn của mình liên tục mà không cần ý kiến, gọi thì ns này nọ. nchung app hãm l",1,2026-04-29 08:17:19,0
hàng OK ae tự tin mua xoài nhép ae,5,2026-04-29 08:09:32,0
"giải quyết vấn đề không thỏa đáng, khóa tài khoản bừa bãi. liên hệ cskh thì không trả lời. bọn cskh cũng chỉ làm công ăn lương mà cửa quyền, thiếu đạo đức nghề nghiệp.",1,2026-04-29 08:02:49,5
"dịch vụ tệ, toàn đổ lỗi cho khách hàng",1,2026-04-29 07:59:02,0
tốt,5,2026-04-29 07:56:21,1
mới tạo acc mà bảo bị lỗi m02 ?,2,2026-04-29 07:53:22,0
hay,5,2026-04-29 07:41:43,0
"đừng đăng kí shopee vip nha mọi người, đky xong mã phải dành dựt, mã 35% đã ít rồi mà có thời gian lên cụ thể canh suốt mà vẫn trượt, uổng tiền đky 1 năm",1,2026-04-29 07:37:47,0
đơn vị ghn om hàng siêu lâu. Không hỗ trợ ko phản hồi,1,2026-04-29 07:27:46,0
dịch vụ tốt đẹp,5,2026-04-29 07:24:40,0
bỏ cái tự giảm âm lượng của điện thoại khi vào ứng dụng,1,2026-04-29 07:21:53,1
ví shopee lúc trước đã đăng nhập rồi tự nhiên bị bắt đăng nhập lại rồi đăng nhập lại thì nó báo không được vui lòng thử lại thử đi thử lại mấy lần nó cũng báo vui lòng thử lại??? rồi muốn làm sao mới đăng nhập lại được đây,1,2026-04-29 07:21:27,0
hay bị lỗi,3,2026-04-29 06:46:30,0
rất tốt,5,2026-04-29 06:46:11,0
👍,5,2026-04-29 06:33:35,0
suốt ngày hủy mã ng mới đau lòg hơn bị scam nx,1,2026-04-29 06:18:59,1
mua ko đv rồi bị hủy khuyên các bn ko nên tải về,1,2026-04-29 06:13:52,1
"tôi đã đặt 5 đơn 0đ vì dùng mã giảm giá nhưng ship phơ ko giao , mình có nói với shopee để được hỗ trợ nhiều lần nhưng shopee cho qua và ko làm gì cả, mình rất tức giận😡",1,2026-04-29 06:12:05,2
okkkk,5,2026-04-29 05:57:50,0
tăng giá sàn quá cao,1,2026-04-29 05:56:12,3
sao tôi xem like mà không hiện phần xu chờ để nhận...mất tích chỗ đó luôn,5,2026-04-29 05:55:21,0
tốt nhất,5,2026-04-29 05:41:50,0
ok,5,2026-04-29 05:30:44,0
ứng dụng tốt,5,2026-04-29 05:15:20,1
ngon,5,2026-04-29 05:13:59,0
đồ rẻ và chất lượng,5,2026-04-29 04:48:20,0
10₫,5,2026-04-29 04:40:28,0
"làm gì kì. Tự nhiên hủy hàng người ta, đợi 10 chưa thấy giao",1,2026-04-29 04:35:47,0
thank...,5,2026-04-29 04:25:32,0
Tuyệt vời. rất thuận lợi trong việc mua sắm.,5,2026-04-29 04:25:00,3
thích,5,2026-04-29 04:02:40,0
hay,5,2026-04-29 03:54:56,0
Mắc gì vừa vào app lại chuyển vào mục Live&Video rồi tự kéo âm lượng của máy xuống? Đứa nào đưa ý tưởng thiết kế ngu vậy :),1,2026-04-29 03:51:17,4
rất ok,5,2026-04-29 03:41:52,0
shipper KHÔNG GỌI MỘT CUỘC NÀO từ 22/4 đến 28/4 xong shopee đổ thừa cho khách là không nhận cuộc gọi :) cskh như qq,1,2026-04-29 03:32:53,0
shopee ko trân thật bán diều sáo mà đưa cái áo là sao,1,2026-04-29 03:28:41,1
👍👍👍,5,2026-04-29 03:26:12,0
ít xu còn lằng nhằng,1,2026-04-29 03:21:59,1
thật tuyệt vời 👍,5,2026-04-29 03:13:04,0
"Nhanh chóng, bọc kỳ càng Cảm ơn",5,2026-04-29 02:58:01,0
tệ,1,2026-04-29 02:31:32,1
dịch vụ này tốt mình thấy tiện lợi,5,2026-04-29 02:06:04,0
tốt,5,2026-04-29 01:48:09,0
có nhiều lỗi ko đặt hàng được,4,2026-04-29 01:46:17,0
"app lớn nhưng tệ , toàn chạy quảng cáo bừa bãi, áp mã giảm giá bảo không phù hợp với đơn hàng trong khi mã nó chỉ bảo là tối thiểu 0đ và chả còn báo cái lí do nào khác mà sài không được",1,2026-04-29 01:40:56,0
"quảng cáo chèn khắp nơi, ko có chỗ tắt, app quá rẻ rách",1,2026-04-29 01:22:40,4
tiện lợi,5,2026-04-29 01:18:54,0
tot,5,2026-04-29 01:06:11,0
tôi thích shoppe,5,2026-04-29 00:32:39,0
ok,5,2026-04-29 00:11:42,1
mua cái đơn hàng với mã giảm giá lúc nào cũng bị gặp lỗi,1,2026-04-29 00:06:41,1
"giao nhanh,tiến bộ,có cải tiến,đáng tin cậy",5,2026-04-28 23:53:20,1
mua sắm tiện lợi,5,2026-04-28 23:53:01,0
mua các món hàng trên shopee rất uy tín chất lượng cao hơn nhiều so với những ứng dụng khác.Còn được trả hàng miễn phí khi gặp vấn đề.,5,2026-04-28 23:22:59,1
chán phèo,1,2026-04-28 22:41:19,0
quá tuyệt vời,5,2026-04-28 20:21:55,0
shoppe tự í hủy đơn của khách nhiều lần,1,2026-04-28 17:51:33,4
ok,5,2026-04-28 16:42:11,1
không áp dụng hay lạm dụng mã người mới vẫn bị lỗi m02,1,2026-04-28 16:10:14,2
giá siêu hời,5,2026-04-28 15:54:54,0
trả hàng shipper kh thèm qua laya hay gọi luôn lm ăn h tệ v,1,2026-04-28 15:34:33,1
Okey,5,2026-04-28 15:30:57,1
rất ok,5,2026-04-28 15:28:16,0
dịch vụ trả hàng quá lỏ,1,2026-04-28 15:06:50,0
rất tuyệt vời,5,2026-04-28 15:02:19,3
rat tot,5,2026-04-28 14:26:35,0
oki,5,2026-04-28 14:25:31,0
Các mặt hàng đúng mô tả từ shop. Hỗ trợ tốt với chi phí vận chuyển và sale off,5,2026-04-28 14:18:23,1
giá rẻ 😆😆😆😆,4,2026-04-28 14:17:09,0
thông báo nhiều ít lại,1,2026-04-28 13:46:57,1
thấy cũng ok hơn tiktok,5,2026-04-28 13:39:04,0
ship đắt lắm,3,2026-04-28 13:32:18,0
trả trước tiền onl r mà tự hủy hàng kêu lí do chưa thanh toán,1,2026-04-28 13:31:19,0
"giao đơn chậm kinh khủng ,trễ so với dự kiến nhiều ngày,tự hoàn trả hàng lại người bán trong khi chưa giao nói chung là trải nghiệm siêu tệ và sẽ không sử dụng lại",1,2026-04-28 13:23:24,0
"để quả map chả có miếng tác dụng gì, shipper cứ gọi hỏi địa chỉ dù nó rõ rành rành trên map. Rồi shipper cũng troll, gọi bảo ra nhận hàng mình đứng đợi 30p chẳng thấy ai.... Thà hủy đơn chứ nhất quyết không giao trễ. Các anh đúng là thiên tài.",1,2026-04-28 13:10:12,6
🥰🥰🥰🥰,5,2026-04-28 13:07:27,0
♥️,5,2026-04-28 12:55:31,0
không Cho,1,2026-04-28 12:40:32,0
Rất nhiều cái thứ vị,4,2026-04-28 12:24:28,0
rất tiện lợi cho việc mua sắm,5,2026-04-28 12:06:24,0
"app linh tinh , đồ đểu fake , hủy hàng khách , ...",1,2026-04-28 11:50:49,1
"shopee xem lại cứ mỗi lần mở ứng dụng thì âm lượng điện thoại bị giảm tới mức tối thiểu, rất bực mình",4,2026-04-28 11:50:38,0
lỗi nhiều,3,2026-04-28 11:48:56,0
"Lần đầu tiên trong nhiều năm sử dụng shopee mà phải lên đây đánh giá 1 sao. Người giao hàng của SPX rất xem thường khách hàng, liên tục tự động hủy đơn hoặc dời thời gian giao hàng mà không hề có một cuộc gọi nào.",1,2026-04-28 11:44:15,2
mua được nhiều thứ,5,2026-04-28 11:42:58,0
lừa đảo 🤥 thế phải đổi đth,1,2026-04-28 11:31:35,1
ổn,4,2026-04-28 11:26:51,0
ok,5,2026-04-28 11:24:41,0
lấy thêm tiền ship nhanh có lúc tận 30k mà ship vẫn lâu có lúc quá ngày dự kiến giao hàng mà ko đc vc còn tự đổi ngày giao hàng,1,2026-04-28 11:08:38,2
có nhiều voucher freeship tuyệt vời.,5,2026-04-28 11:03:37,0
tại sao tôi không đặt hàng được vậy,2,2026-04-28 11:03:32,1
hàng sai không đúng mua 242k muốn hoàn hàng mà đăng nhập tài khoản ngân hàng xong hết rồi thì bị thoát ra đã làm 2-3 lần nhưng vẫn bị vậy không biết là sao bộ không cho hoàn hàng à chịu luôn,1,2026-04-28 10:58:32,6
app rất tiện lợi uy tín,5,2026-04-28 10:50:39,0
ship siêu lâu đặt 2 tháng mà vẫn chưa đến 🤬🤬🤬🤬🤬🤬🤬🤬🤬,1,2026-04-28 10:47:58,1
đăng hàng không đúng giá,3,2026-04-28 10:42:44,1
"app quá tệ, hàng mình lúc đầu là ngày 27 giao giờ cứ đổi qua lại ngày 28,29,30,mình mong shoppe khắc phục tình trạng này.",1,2026-04-28 10:40:45,4
ọk,5,2026-04-28 10:39:45,0
ok,5,2026-04-28 10:26:02,0
DUYỆT RẤT LÀ OK !!!,5,2026-04-28 10:23:09,0
sử dụng ổn nhưng qc khá nhiều mở lên là gặp thậm chí có qc từ 1 năm trước vận hiện lại,4,2026-04-28 10:21:20,1
shop uy tín gửi hàng nhanh hàng chất lượng,5,2026-04-28 10:12:29,2
dạo này shopee sử lý các đơn nhanh ok cảm ơn shopee nhưng shopee phài làm sao chứ toi mua hàng bị shop đăng sản phẩm một đằng giao hàng loại khác không đúng đơn mua mất thời gian lỡ hết việc . trả lại . thấy không minh bạch của các shop bán cần cái đúng,5,2026-04-28 09:55:55,1
thời gian trả hàng hoàn tiền là 15 ngày. phải tính ngày làm việc. chứ mấy ngày lễ t7.cn shop bán đâu làm việc đâu mà xử lý.,1,2026-04-28 09:54:03,7
nhu cuc,1,2026-04-28 09:51:57,0
giao hàng muộn mà hay thay đổi ngày dự kiến giao hàng,1,2026-04-28 09:51:17,2
ápnày quá ok,5,2026-04-28 09:22:23,0
tốt,5,2026-04-28 09:21:50,0
quá tệ tôi đặt 3 đơn hủy cả 3,1,2026-04-28 08:28:59,0
Ok,5,2026-04-28 08:22:47,1
xài tốt,5,2026-04-28 08:16:33,0
app càng ngày quá tệ: ép người dùng xem live& video khi mở app. bên vận chuyển thì nhiểu lần tự ý hủy đơn hàng của mình mà không rõ lí do. cứ đà này phải chuyển qua tiktok mua thôi,1,2026-04-28 08:14:52,0
