review_text,rating,review_date,thumbs_up
thêm nhìu vocher giảm giá cho tui còn 0đ thì sẽ dc 5 sao aa,4,2026-04-12 10:35:40,0
cho 1 sao. đặt đơn áp mã gg . đơn tới bưu cục giao gần nhà tự động hủy đơn. trả về người bán. riết thấy k đc.🙅,1,2026-04-12 10:22:14,1
shopee thật tuyệt vời,5,2026-04-12 10:19:55,0
ok,5,2026-04-12 10:18:35,0
"chất lượng nha,đặt j có đó ln",5,2026-04-12 10:15:41,0
giao hàng hơi chậm nhưng hàng chuẩn ko hỏng bảo quản tốt,5,2026-04-12 10:12:48,0
Nền tảng mua sắm tin cậy.,5,2026-04-12 09:58:06,1
rat thuận tiện cho việc mua bán trực tuyến,4,2026-04-12 09:58:06,0
bọn này bao che hàng giả kém chất lượng,1,2026-04-12 09:49:45,2
mở app lên luôn cứ mặc định ở mục live&video bấm chọn sang mục home để tìm thứ mình cần mà cứ nghe rên rỉ từ video lúc mới vào app. rất chi là bực bội. không câm họng lại nổi cứ rên ư ử. ai cần nghe hay muốn xem đâu,1,2026-04-12 09:43:34,1
"hoàn hàng lắm yêu cầu , nhận và đóng hàng đòi 6 mặt . còn hàng sao nó kệ nha . Hàng mình nhận và đóng hoàn có lớp nilong lốm đốm bóng khí , còn shop khui hoàn không còn lớp này đúng ảo . Nhưng vì video không đủ 6 mặt và ko có dán mã hoàn nên nó xử mk sai nha . Đóng gửi bưu tá không sao shop nhận lại vỡ 🤣 , không biết vận chuyển sao nhưng cách xử lí chán . Qua tiktok mà mua hàng nha",1,2026-04-12 09:29:29,0
đặt hàng mà shipper k có ship cho mik mà tủ nhận hàng cách hơn 3km thì khỏi dùng shoppe nữa😇,1,2026-04-12 09:27:13,1
tốttt tiện lợi,5,2026-04-12 09:25:54,0
Tôi thích mua hàng trên shopee,5,2026-04-12 09:18:41,0
tốt,5,2026-04-12 09:15:05,0
"Ứng dụng shopee rất tốt, rất xứng đáng được xếp hạng 5*. Nhưng có 1 vài shop gởi hàng không đúng theo quảng cáo, mặc dù đã liên hệ nhắc nhở, mà gởi 2 lần vẫn không đúng theo hàng đặt mua. Làm kéo dài thời gian, trì trệ công việc của khách hàng.",5,2026-04-12 09:06:37,1
tốt,5,2026-04-12 09:04:14,0
"khóa acc vô cớ, mua đơn hời giá ngon áp xu nhiều là khóa acc người dùng",1,2026-04-12 08:59:43,1
"sau này mua hàng nội địa trung quốc dùng, cho mấy thằng bán hàng không uy tín tại Việt Nam phá sản",5,2026-04-12 08:55:13,65
quảng cáo cái l gì hoài vậy m.á bộ muốn hết tg tải shoppe hả cha,1,2026-04-12 08:46:52,0
mặt hàng rất đa dạng đặt hàng còn xong có ô cảnh báo bị lừa shipping,5,2026-04-12 08:43:29,1
cũng dc,3,2026-04-12 08:29:38,0
"Uy tín, dễ sử dụng, hàng lỗi được hoàn tiền",5,2026-04-12 08:18:53,1
mọi thứ điều tốt !,5,2026-04-12 08:16:00,0
shopee rất hữu ích thuận tiện cho người dùng xin cảm ơn,5,2026-04-12 08:08:49,3
có nhiều hàng 0đ ngon thì,5,2026-04-12 08:07:12,0
Nên cho thêm nhiều cách tích xu hơn,3,2026-04-12 08:06:31,0
Tiện lợi,5,2026-04-12 07:59:53,0
Phục vụ dấn ké không dóng như quảng cáo tôi muốn kiếu nại,1,2026-04-12 07:56:52,2
quảng cáo hơi nhiều,4,2026-04-12 07:53:12,1
do tui ko bt sài hay sao nhưng thấy đặt cái nào cx phải tự kiếm tủ đeer đi lấy mà nó xa vl chỉnh sang giao tận nơi thì ko đc 🙂😇,1,2026-04-12 07:52:31,0
tốt 😁,5,2026-04-12 07:47:10,0
"mua sắm thì đc, nhưng thông tin bảo mật của người dùng thì tệ hại , thiết bị chỉ đăng ký đúng một tài khoản , giờ kiểm tra lại ko hiểu tại sao tài khoản đăng ký bằng FB hay gg lại bị giới hạn bị mất email mặc dù chưa bao giờ đăng ký bằng 2 tk đó . Nếu như tôi ko tình cờ kiểm tra thì giờ đã không biết mình bị TT cá nhân nhiều đến vậy",2,2026-04-12 07:25:14,0
"Rất legit nhưng có vấn đề, khá hiếm nhưng vẫn có là hàng báo vẫn đang ở chỗ người bán nhưng thực chất là đã ở chỗ shipper rồi, thành ra rất bất ngờ với lại ko chuẩn bị trc😄",4,2026-04-12 07:20:23,1
shop dất thiện nợi,5,2026-04-12 07:13:22,0
"Bộ phận công nghệ phần mềm rất tệ Bộ phận công nghệ phần mềm rất tệ Bộ phận công nghệ phần mềm rất tệ. Sử lý app lỗi hoài, lỗi nặng nhất là phần game, làm hết nhiệm vụ xong không được gì hết, công cốc khi làm một số nhiệm vụ. Đề nghị chấn chỉnh lại đội ngủ kts",1,2026-04-12 07:11:32,83
oke nh,5,2026-04-12 07:11:02,0
mãi mới mua được cái gói shopee vip mà sao shopee chơi kỳ quá à? đặt hàng giảm giá xg tới lúc sắp nhận rồi chơi hoàn lại vậy?? sự thì đừng lm cái shopee vip?,1,2026-04-12 07:11:00,2
"Có quá nhiều shop bán hàng không đúng video đăng quảng cáo làm khách hàng cãm giác bị lừa.shope nên dẹp cho môi trường buôn bán được công bằng, văn minh hơn.",4,2026-04-12 06:46:25,0
tệ vl,1,2026-04-12 06:45:41,1
Tốt,5,2026-04-12 06:45:30,0
"Việc thay đổi tt ví shoppay loằng ngoằng phức tạp. Việc xác minh tt 2 ví shoppay cùng 1 con người và giấy tờ theo kiểu máy móc thận trọng thừa , mất t.gian . Nói chung CHÁN DẦN ĐỀU. Đã từng ra sức quảng cáo ko công cho shoppee và shoppay để mn lập tk mua bán trên đó. Nhưng giờ thấy quá bực vì cách làm việc , xác minh tt phiền hà phức tạp. Cách hỗ trợ của nhân viên cũng chảnh kiểu như mày cần chúng tao chứ chúng tao thừa khách rồi. Cứ phong cách này thì shoppee và shoppay sớm bay khách hết thôi",1,2026-04-12 06:43:01,1
được đấy,5,2026-04-12 06:40:58,1
đặt giao nhanh hàng chất lượng,5,2026-04-12 06:39:58,0
"Intrusive Ads, Causing crashes and inconvenience by forcefully open app during ad in other app. don't install if u dont need it",1,2026-04-12 06:32:44,0
tôi rất vui khi được đặt hàng on lai,5,2026-04-12 06:26:46,2
nhiều mã giảm giá rẻ hơn,5,2026-04-12 06:21:54,0
haizzz,3,2026-04-12 06:15:21,0
ok,5,2026-04-12 06:08:44,0
ko đặt được cứ bảo rằng số đt này đã đăng nhập rồi mà số đt chưa đăng nhập lần nào,1,2026-04-12 06:05:55,1
hay,5,2026-04-12 06:00:35,0
sao không cho nhận hàng trực tiếp v trời??,1,2026-04-12 05:56:58,0
tốt:),5,2026-04-12 05:53:10,0
mua hang kem chat luong . tra hang k cho shipper den lấy hang. 1 don hang gan 1 thang chua giai quyet xong. bực bội vô cùng. k hiểu sao hàng kem chát lượng hư bể mà giải quyet lằn ngoằng. lâu. làm người mua mât thời gian mất tiền. rồi niềm tin đâu??? công bằng đâu??,1,2026-04-12 05:52:24,0
phiền nha ???,1,2026-04-12 05:44:54,0
"không đặt được hàng,khó chịu,lỗi",1,2026-04-12 05:44:22,1
chán không có auto.,1,2026-04-12 05:36:27,0
Hơi đắt xíu nhưng chất lượng tốt,4,2026-04-12 05:32:52,0
Trang thông tin mua bán hữu ích,5,2026-04-12 05:24:03,0
"làm cái nhận tủ ứg dụg là chỉ triển khai ở thành phố à, những nơi không có tủ thì khỏi đặt hay gì?",1,2026-04-12 05:23:59,2
OK đó,5,2026-04-12 05:23:32,0
Trước đặt hàng shopee lúc nào cũng về đúng thời gian mà tháng 4 này mình đặt 2 đơn lúc nào nó cũng chỉ đến kho ở từ sơn Bắc Ninh là ở mãi đó ko về nữa quá ngày thì shoppe chỉ tặng cái vế giảm giá là xong . Mong shopee xem lại quá trình giao hàng quả mình để tránh ko còn những trường hợp này sảy ra,1,2026-04-12 05:13:16,0
"khuyến khích người dùng sử dụng bằng cách cho nhận xu mỗi ngày, qua live/video, đến khi người dùng nhận xu nhiều bằng cách xem video thì nói tk bất thường k cho nhận xu, k có lời giải thích nào",1,2026-04-12 05:02:37,0
cứ bắt lại tủ nhận hàng,1,2026-04-12 04:57:11,0
Lúc nào cũng giao hàng cùng 1 shipper dù đã đổi số,3,2026-04-12 04:53:09,0
tôi rất thích,5,2026-04-12 04:50:24,0
"Máy đẹp, cạo râu sát da, rất ổn.",5,2026-04-12 04:40:43,1
ok,5,2026-04-12 04:36:23,0
sàn uy tín.,5,2026-04-12 04:33:42,1
"giá rất ok á -))) có nhiều mã, giao diện dễ thao tác",5,2026-04-12 04:33:06,0
"app cập nhật địa chỉ sau sáp nhập xong bị lỗi địa chỉ nhận hàng, mua hàng toàn chỉ có phương thức tủ nhận hàng, app lỗi nói nhân viên thì không giải quyết toàn nói vòng vo tào lao, không bộ phận nào giải quyết",1,2026-04-12 04:32:57,0
"hàng giao bình thường thì chuyển hoàn, mất trắng mã giảm, không có biện pháp đền bù phù hợp, tệ",1,2026-04-12 04:26:32,3
ok,5,2026-04-12 04:25:20,0
tủ nhận hàng là cái mẹ j cứ bắt có?,1,2026-04-12 04:11:06,0
cũng ngon nhưng mà tiền ship thì hơi chát,5,2026-04-12 04:08:24,0
rất hài lòng,4,2026-04-12 04:06:29,0
"mọi người bảo mình sao cứ mua trên Shopee làm gì,có hợp với mình đâu thì theo mình mua hàng trên Shopee tiện ích nhất ,tuy có mặt hàng ưng ý và không ưng ý nhưng tiệncái là trảlại hoàn tiền dễ dàng không phải lăn tăn gì, chúc shoppe ngày càng phát triển và uy tín chất lượng hơn",5,2026-04-12 04:04:35,5
"Ok, tui thấy đóng gói và giao hàng nhanh. SPX ok nha.",5,2026-04-12 04:02:22,2
lỗi không trả hàng được xử lí kém,1,2026-04-12 03:59:04,2
hay,5,2026-04-12 03:58:30,0
"Tôi thích shoppe vì shoppe rât linh hoạt! Với hạng mục thanh toán shoppe, tui có thể sử dụng spaylater để linh hoạt chi tiêu, từ đó linh hoạt tài chính. Tại shoppe có những hạng mục shop yêu thích, shop bán chạy (top), shop Mall dễ dàng cho tui lựa chọn và tin tưởng hơn 👍 Ngoài ra còn có gói shoppe VIP, mỗi ngày cho tui giảm 20% với đơn trên 100k trở nên, thích hợp với mấy đứa hay mua hàng onl như tui. Tại Shoppe có rất nhiều mặt để tui lựa chọn và mua sắm. Từ gia dụng, mĩ phẩm... tui ❤Shop",5,2026-04-12 03:55:48,1
mua hàng 0đ mà khi giao về lại mấy trăm đồng phí ship lại còn cao nữa mua 0đ mà phí ship tận 50k khiến mình cảm thấy bực bội và khó chịu,1,2026-04-12 03:46:34,0
"phương thức vận chuyển; giao hàng tận nơi không hoạt động chỉ có lấy hàng chủ động là còn hoạt động nhưng mà ở địa chỉ An Giang, U Minh thượng là không tìm thấy vị trí có tủ nhận hàng shop cho tôi biết làm cách nào để khắc phục và chuyển đổi thành giao hàng tận nơi được không?",1,2026-04-12 03:45:57,0
"rất tệ, số hotline chăm sóc khách hàng thì không cho khách hàng có cơ hội đưa ra thắc mắc, là giọng máy phát đi thôi, lỗi lên lỗi xuống, thái độ của CSKH cũng rất tệ, chưa lần nào mình được giải quyết vấn đề cả",1,2026-04-12 03:41:55,0
Rất đẹp. Mình muốn đặt hàng. Hẻm 46.đường 112.xã tân thạnh đông huyện củ chi TP HCM.,4,2026-04-12 03:29:43,0
nhu cc.. deo dinh vi dk vi tri,1,2026-04-12 03:15:22,1
like,5,2026-04-12 03:12:58,0
đẹp,5,2026-04-12 03:08:12,0
tốt,5,2026-04-12 02:58:21,0
khg nên,1,2026-04-12 02:44:08,0
tệ,1,2026-04-12 02:43:59,0
nó không áp dc mã 80,1,2026-04-12 02:37:47,0
Nhu c,1,2026-04-12 02:25:35,0
đã mua hai mẫu ưng ý mua thêm,5,2026-04-12 02:11:59,0
nhiều tb vl,1,2026-04-12 02:05:05,0
nhanh,5,2026-04-12 01:48:29,0
tôi rất thích ứng dụng này,4,2026-04-12 01:35:14,1
tôi rất tòm mò và tìm hiểu về sàn shop,5,2026-04-12 01:25:32,0
cũng ổn,4,2026-04-12 01:23:06,0
❤️‍🩹,5,2026-04-12 01:17:42,0
tuyệt vời,5,2026-04-12 01:17:22,0
Dám khoá acc t còn ko cho t khuyến mãi bịp à?????,1,2026-04-12 01:05:20,0
ok,5,2026-04-12 01:02:09,0
tốt nhé. sp hàng mail uy tín,5,2026-04-12 00:50:14,0
very good,5,2026-04-12 00:34:11,0
"shipper giao hàng kiểu gì mà hàng móp méo , lần thứ 4 đặc hàng mà shipper cọc ch€t m€ luôn , mà ổng nói chuyện kiểu j á sáng sớm cở đó .",5,2026-04-12 00:33:26,0
tốt,5,2026-04-12 00:28:38,0
"dịch vụ tệ. Yêu cầu trả hàng hoàn tiền nhưng liên tục không được giải quyết, không ai tới lấy hàng. Tư vấn liên tục hứa hẹn giục lấy hàng, hứa ngày hôm sau sẽ lấy ngay, nhưng vẫn ko có ai đến. Cuối cùng shopee tự hủy đơn hoàn hàng với lý do ko trả hàng đúng hạn, trong khi mình yêu cầu đến tận nhà lấy hàng.",1,2026-04-12 00:27:22,4
ứng dụng rất tốt,5,2026-04-12 00:19:17,0
như l,1,2026-04-12 00:15:41,0
ok,5,2026-04-11 23:51:22,0
đơn đã thanh toán qua internet banking hủy do quán hết món xong đợi tận hơn 2 tuần vẫn không thấy tung tích của việc hoàn tiền. Quá tệ,1,2026-04-11 23:41:14,0
rất hay,5,2026-04-11 23:28:29,0
tôi thật sự rất thích thú với ứng dụng này thật tuyệt vời OK ⭐⭐⭐⭐⭐⭐,5,2026-04-11 23:05:13,0
đa dạng mặt hàng nhưng sp bán nhiều món chưa chất lượng lắm,3,2026-04-11 23:02:35,0
tốt,5,2026-04-11 21:38:00,0
"Trả đơn đặt hàng không được , khách hàng là thượng đế nên yêu cầu bộ phận làm việc phải tuân thủ khách hàng !!",1,2026-04-11 20:34:37,1
ok,5,2026-04-11 19:38:12,0
tôi rất thích 👤💛😇♥️🦋🌺🥴👏💥👿👄✋🤣🍒💓💗🥲🥴🦋🌶️♥️♥️😇👤🌹💥👿🥲🦋🥀,5,2026-04-11 19:00:43,0
mẹ nó mua gói shopee vip thì quảng cáo tặng mã chat gpt go... giờ mở mã ra không được.. giỡn mặt tao hả?,1,2026-04-11 18:48:16,0
"-1 sao vì mỗi lần tắt quảng cáo, dấu X có chút xíu, bấm tắt là tự động chuyển đến shopee.",4,2026-04-11 18:33:52,0
rất tốt,5,2026-04-11 18:27:55,0
cái map giao hàng shoppe nó bị cái gì vậy sai tùm lum r sao tao theo dõi đơn hàng ?,1,2026-04-11 18:22:24,10
dịch vụ tuyệt,5,2026-04-11 18:02:29,0
tốt,5,2026-04-11 16:56:11,0
"trải nghiệm quá tệ shop tự hủy hàng của khách, giao hàng thì lâu nói chung là không lên dùng",1,2026-04-11 16:19:41,0
app dùng rất ổn,5,2026-04-11 16:19:04,2
treo đầu chó bán thịt dê,1,2026-04-11 16:04:33,0
tự động hủy hàng và cũng ko hoàn lại tiền ??,1,2026-04-11 15:57:09,0
tốt,5,2026-04-11 15:49:39,1
đặt hàng thì hàng tự hủy là sao? đặt lại thì bảo mã hết hạn ?,1,2026-04-11 15:33:23,0
ok,5,2026-04-11 15:06:11,0
"cho lắm mã giảm giá mà đeo dùng đc sát minh cho cố vô rồi M2 ,1 sao áp l//",1,2026-04-11 14:57:17,4
tuyệt,5,2026-04-11 14:54:41,0
"thêm tủ nhận hàng làm j bt chỗ có chỗ ko ,hình thức giao tận nơi thì ko đc .chắc shopee để làm cảnh",1,2026-04-11 14:44:48,0
thủ tục hủy hàng rắc rối,1,2026-04-11 14:44:43,0
"tiện , nhanh,gọn ,lẹ",5,2026-04-11 14:44:07,0
"bấm trượt vào bất kỳ quảng cáo nào cũng dẫn đến shoppee lên tôi đã gỡ app, app rác",1,2026-04-11 14:26:16,0
"hàng hoàn trả không điều shipper tới lấy được thì tụi bây nên ghi thẳng trên mục hoàn trả là khách tự đem tới bưu cục đi, để khách như tụi tao không phải rảnh chờ đợi rồi nhắn nhờ trợ giúp tụi bây, bớt làm mất thời gian cái",1,2026-04-11 14:24:58,0
"Shopee rất đa dạng sản phẩm, nhiều chương trình khuyến mãi, giá cực kỳ tốt. i love shopee.",5,2026-04-11 14:24:04,2
rất ok.,5,2026-04-11 14:11:21,2
ok,5,2026-04-11 13:55:55,0
"Shipper làm việc không uy tín ( Tuyên ) giao hàng chậm trễ, hay giao vào những lúc khách k có ở nhà( khách hàng đã để lại lời nhắn là giao vào thời đểm nào.....nhưng shipper vẫn cố tình giao ngoài giờ) xog hủy hàng.",1,2026-04-11 13:51:50,2
"thông báo tin vặt ít thôij, giờ nào cũng shop pe,bị khùng hay gì vặt miết vậy??",2,2026-04-11 13:40:19,0
"Quá thất vọng, ko ngờ mk cx cs ngày này.Đặt đơn áp đc mã ngon, shopee cx cho đi đơn đến trạm cuối cùng nhưng lại mấy ngày liền ko giao dù ngày thường.Khiếu nại lại bảo sẽ bồi thường 10.000xu trong khi mk áp mã giảm tận 60k.R lời hay lỗ.Vừa ko cs đồ dùng vừa ko còn mã tốt.Rất tệ.Đáng giá -sao",1,2026-04-11 13:36:12,1
khó chịu,1,2026-04-11 13:30:24,0
tải rất lâu nha,1,2026-04-11 13:30:23,0
hết nhân viên hay sao tủ nhận hàng ko rảnh giao tận nơi ko đc hả ưu tiên khách,1,2026-04-11 13:28:46,0
Cứ quảng cáo chiếm quyền sử dụng máy rất khó chịu,1,2026-04-11 13:28:05,1
rất hài lòng,5,2026-04-11 13:20:20,0
"bộ phận vận chuyển quá tệ, đang cần đơn gấp mà mãi 6 ngày rồi không thấy giao đã vậy còn trễ hơn 3 ngày dự kiến giao hàng",1,2026-04-11 13:01:19,3
tôi là fan shopee nhưng dạo này trả hàng rất khó khăn. dù bên bán sai. yêu cầu chụp hình gắt gao sản phẩm trả. cần xem lại chi nhánh Cần Giuộc. đà này sẽ thất bại trước tiktok. họ chỉ cần chụp bao bì vỏ ngoài là duyệt ngay. bái bai nhé,1,2026-04-11 12:57:06,2
"Shoppe chính sách tệ, không xử lý vấn đề của khách, luôn tìm cách đổ lỗi cho khách hàng, lừa dối khách hàng, mọi người đừng nên sự dụng để tránh bị ấm ức về mình, giờ đã có rất nhiều sàn tốt hơn rồi",1,2026-04-11 12:55:58,2
đặc ko đc nhận hàng chủ động thì ko đc chuyển qua giao hàng tận nơi thì xác nhận ko đc 😡😡😡,1,2026-04-11 12:55:43,4
"rất ổn, Ai tìm kiếm hơi ngu",5,2026-04-11 12:55:32,1
tôi rất yêu app này 😍😍😍😍😍😍,5,2026-04-11 12:51:44,0
ok,5,2026-04-11 12:34:05,0
tốt,5,2026-04-11 12:30:44,0
mua đồ k nhận dc hàng mà dám để đã giao,1,2026-04-11 12:27:40,1
khá dễ dàng khi mua hàng.,5,2026-04-11 12:19:51,5
được,5,2026-04-11 12:16:28,0
"ứng dụng tuyệt vời, phù hợp săn sale",5,2026-04-11 12:16:19,1
giao hàng rất chậm,1,2026-04-11 12:07:59,0
tài khoản của tôi không thể cập nhật địa chỉ theo đơn vị hành chính mới. Cho nên mọi đơn hàng liền bị hủy khi mua.,2,2026-04-11 12:07:34,0
Nhanh và tiết kiệm,5,2026-04-11 12:03:48,0
OK,5,2026-04-11 12:02:04,0
ít mã giảm quá,5,2026-04-11 11:54:29,1
app rất tốt nhưng ko thỏa mãn mua đồ,5,2026-04-11 11:48:18,2
mua hàng trên shopoe rất hài lòng,5,2026-04-11 11:45:00,1
Dẹp luôn cái giao hàng trong ngày dùm cái. Trong ngày gì mà 3 ngày chưa giao? Làm ăn kiểu đó đó.,1,2026-04-11 11:33:56,0
đợi hàng cực kì lâu,1,2026-04-11 11:31:28,1
rất là hay,5,2026-04-11 11:20:00,0
oki nha,5,2026-04-11 11:07:25,0
"Không mô tả rõ ràng các mặt hàng nào hạn chế đổi trả, đến khi trả hàng hệ thống mới thông báo. Qui trình làm việc cứng nhắc, thiệt hại khách hàng phải chịu. Hàng shopee tự đóng gói và giao bị thiếu, trả hàng hoàn tiền thì xử lý cả 1 tuần, sao không thấy cải tiến mà toàn cải lùi vậy. Đẻ ra cái chức năng hối thúc cho có, ngày nào cũng hối mà không nhanh được một xíu nào.",1,2026-04-11 11:07:15,5
yêu cầu gặp nhân viên không được,1,2026-04-11 11:01:48,0
ok,5,2026-04-11 10:52:22,0
good,5,2026-04-11 10:45:00,0
tốt,5,2026-04-11 10:39:06,0
OK sai hàng hoàn tiền rất nhanh,5,2026-04-11 10:38:44,0
ok,4,2026-04-11 10:38:30,0
ok phết,5,2026-04-11 10:36:36,0
"tôi rất thích ứng dụng này, nhanh giao dịch tiện lợi, giá sp hợp lý.",5,2026-04-11 10:36:14,0
"hồi này shopee không trả được hàng rất bất tiện, mua hàng online sao chính xác được, ra cửa hàng mua, người ta còn cho trả hàng, shopee không hỗ trợ trả hàng làm tôi lo lắng, không dám mua thoải mái nữa, giờ phải cân nhắc thật kỹ, mấy đồ mua gần đây bỏ không dùng được uổng phí rồi",4,2026-04-11 10:25:25,0
làm tốn tiền t,5,2026-04-11 10:22:53,0
WÁ tốt,5,2026-04-11 10:20:37,2
đc,5,2026-04-11 10:02:05,0
"đùa thật đấy, cái nick vừa đăng ký báo vi phạm ko cho dùng là ý gì",1,2026-04-11 09:59:41,1
tuyệt vời,5,2026-04-11 09:45:16,0
"Thanh toán ví spaylater , đã trừ tiền rồi mà giao dịch ko thành công cũng ko thông báo gì cho ngta hết. Tiền hoàn về số dư sp , đâu phải lúc nào ngta cũng rảnh để vô sp xem số dư sp đâu. Rồi giờ phải tốn phí trả chậm oan uổn , chán",1,2026-04-11 09:37:23,3
good,5,2026-04-11 09:32:12,0
dich vụ rất tốt,5,2026-04-11 09:25:43,0
cứ bắt người dùng chọn tủ nhận hàng,1,2026-04-11 09:02:52,2
đặt mà toàn bị hủy ko à,1,2026-04-11 08:59:19,0
"Đơn đang ship thì bị hủy, hỏi cskh thì báo là có dấu hiệu bất thường và vì lý do bảo mật nên không thể nói rõ, nói thế ai chả nói được",1,2026-04-11 08:47:26,0
tốt,4,2026-04-11 08:44:31,1
tôi rất thích,5,2026-04-11 08:42:11,0
khuôn mặt của mình mà xác thực không được bó tay,1,2026-04-11 08:38:25,1
rẻ,5,2026-04-11 08:27:52,0
quá đẳng cấp,5,2026-04-11 08:27:29,0
"không tại sao lập tài khoản nào cũng kh mua được là sao , mà không có lập nhiều ac nha",1,2026-04-11 08:23:22,0
mới tạo tài khoản vô đặt hàng ko đặc được cứ kêu là M02/D02 bật mình,1,2026-04-11 08:21:44,0
"ok đó, chỉ là tôi vào ứng dụng khác gặp quảng cáo là tự mở shopee luôn, ghét bỏ mẹ, làm máy tôi lag luôn chứ.",1,2026-04-11 08:20:49,1
hay sao vì hàng pha kề nhiều quá,2,2026-04-11 08:20:40,0
"Kh mua đc đồ, mua mà hiển thị kh có vj chí cố định",1,2026-04-11 08:06:31,0
như cak đừng nên dùng,1,2026-04-11 08:04:18,1
sài Shopee thật là tuyệt vời và sản khoái hơn thẳng,5,2026-04-11 07:55:35,1
tuyệt vời hơn một siêu thị!,5,2026-04-11 07:53:26,1
lỗi vặt nhiều kinh khủng,1,2026-04-11 07:50:31,2
shoppe nên kiểm tra lại ứng dụng của mình có nhiều tài khoản tặng tiền tặng su có đường Link dẫn dụ khách hàng rất nguy hiểm,3,2026-04-11 07:41:51,6
mẹ nó đặt hôm thứ tư rồi giờ còn chưa thấy giao phải chi ở xa đi rồi không nói nhưng này ở Thành Phố Hồ Chí Minh trên tik tok hai ngày có còn này 4 ngày chưa thấy tôi khuyên mọi người đừng có tải ứng dụng này,1,2026-04-11 07:38:12,0
đợi thức ăn 3 tiếng k cho hoàn tiền,1,2026-04-11 07:32:52,2
mất dạy,1,2026-04-11 07:21:09,0
rất tốt,5,2026-04-11 07:13:40,0
"tệ lúc trước giao hàng mới trả tiền bây giờ phải thanh toán bằng thẻ tín dụng,đa số người dân, người lớn tuổi và trẻ em dưới 18 tuổi đau ai cũng sử dụng thẻ tín dụng chứ",1,2026-04-11 07:12:00,2
ok,5,2026-04-11 07:09:31,0
ổn,5,2026-04-11 06:59:34,0
dùng ok nhưng một số lúc vẫn hơi lác và ko nhận ra vấn đề cần hỏi,4,2026-04-11 06:50:59,0
đặt hàng mà cứ hủy,1,2026-04-11 06:49:03,2
phí vận chuyển cao vl k giám mua hàng trên shoppe,1,2026-04-11 06:48:50,3
đặt thì dễ dễ kúc trả hàng phải đợi xem xét 3 ngày + thêm 7 ngày tổng 10 ngày để trả hàng mới nhận được tiền hoàn trả,1,2026-04-11 06:45:13,1
Rất tốt. đa dạng sp.có nhiều chương trình giảm giá .Chúc shoppe càng phát triển bền vững 😃😃😃😃😃😃😃😃😃😄,5,2026-04-11 06:44:15,1
Tải app xong đăng nhập bằng sdt ko đc. Gửi opt về nhập vô toàn báo lỗi.,1,2026-04-11 06:33:45,0
hay,5,2026-04-11 06:31:10,2
"Gần đây làm ăn khá chán, đơn giao chậm gần cả tuần, tự ý hủy đơn không có mail hay tin nhắn giải thích với khách hàng, lí do hủy đơn rất vớ vẩn là giao hàng thất bại trong khi không có cuộc gọi đến nào của shipper để thực hiện giao hàng",1,2026-04-11 06:30:31,7
tốt,5,2026-04-11 06:23:27,0
shipper sdt 0334755*** bảo kêu ra lấy mà đợi nữa tiếng xong vào đợi đến tối vẫn k thấy điện lại,1,2026-04-11 06:09:59,5
"shipper gọi mình ngủ ko ghe đc, 2 h sau dậy thấy thế gọi luôn nhưng không trl. 3 hôm liên tiếp mình gọi cho shipper để lấy hàng đều không được. thấy trên app hiện lên mình đã nhận hàng r trong khi đó là chưa có j cả . thất vọng vô cùng!!",3,2026-04-11 06:09:18,0
trò chơi bịp vl gắp thú trúng đ cho đổi thường,1,2026-04-11 06:06:30,1
"Quá lag , đang dùng thì dừng màn hình và bị thoát",2,2026-04-11 05:55:45,4
hàng đã vào kho rồi nhưng mà chưa giao ??? bị cái gì vậy tr trước nhanh lắm mà,1,2026-04-11 05:53:49,0
"Quản lý như qq, ngày nhận một đống tin nhắn spam, méo quan tâm mà cũng nhắn cho đc, quản lý yếu kém Màn hình tối thì k có",1,2026-04-11 05:49:13,3
app rất tốt,5,2026-04-11 05:34:41,0
Như l,1,2026-04-11 05:32:55,0
được,5,2026-04-11 05:26:52,1
quá tệ,1,2026-04-11 05:18:54,0
rất tốt,5,2026-04-11 05:13:32,0
